{
  "name": "input",
  "version": "0.1.0",
  "description": "A single-line text control.",
  "kind": "component",
  "files": [
    {
      "path": "Input.gx",
      "target": "ui/input/Input.gx",
      "content": "package input\n\nprops {\n  Id          string   = \"\"\n  Type        string   = \"text\"\n  Name        string   = \"\"\n  Value       string   = \"\"\n  Placeholder string   = \"\"\n  Class       string   = \"\"\n  Attrs       gx.Attrs = nil\n}\n\n\u003cinput id={p.Id} type={p.inputType()} name={p.Name} value={p.Value} placeholder={p.Placeholder} class={gx.Cx(\"h-9 w-full min-w-0 rounded-md border border-input bg-transparent px-3 py-1 text-base shadow-xs outline-none transition-[color,box-shadow] placeholder:text-muted-foreground focus-visible:border-ring focus-visible:ring-[3px] focus-visible:ring-ring/50 disabled:cursor-not-allowed disabled:opacity-50 md:text-sm\", p.Class)} {...p.Attrs} /\u003e\n",
      "sha256": "67d796fa29a0b700b63e85ecfcd5115ca38e0c0e00939ebbf43cf80ce6d38441"
    },
    {
      "path": "Input.fixtures.go",
      "target": "ui/input/Input.fixtures.go",
      "content": "package input\n\nimport \"github.com/alternayte/gx\"\n\nvar InputFixtures = gx.Fixtures[InputProps]{\n\t\"Text\":     {Placeholder: \"Email\"},\n\t\"Filled\":   {Value: \"ada@example.com\", Attrs: gx.Attrs{{Key: \"aria-label\", Value: \"Email\"}}},\n\t\"Disabled\": {Attrs: gx.Attrs{gx.Bool(\"disabled\", true)}, Placeholder: \"Disabled\"},\n\t\"File\":     {Type: \"file\", Attrs: gx.Attrs{{Key: \"aria-label\", Value: \"File\"}}},\n}\n",
      "sha256": "03981d58d6d21260105b8fe87c8ea077e2b5e937d51b696ac134433bc6c2df39"
    },
    {
      "path": "styles.go",
      "target": "ui/input/styles.go",
      "content": "package input\n\n// inputType returns the type of the input; a zero value is text.\nfunc (p InputProps) inputType() string {\n\tif p.Type == \"\" {\n\t\treturn \"text\"\n\t}\n\treturn p.Type\n}\n",
      "sha256": "be9805b57a16cf51f1e90da7c45cd571afccbbf048ef8342f2cd1e1d7a192493"
    }
  ],
  "requiredTokens": [
    "--input",
    "--ring",
    "--muted-foreground"
  ],
  "usage": "# Input\n\nA single-line text control.\n\n## Usage\n\n```gx\n\u003cinput.Input name=\"email\" type=\"email\" placeholder=\"Email\" /\u003e\n```\n\nFor a form with rules and errors, use the generated `gx.FormField` control instead.\n\n## Do\n\n- Always pair an input with a label.\n- Set `Type` to the data the field expects.\n\n## Don't\n\n- Do not use placeholder text as a label.\n- Do not build `value` from untrusted text without escaping. Gx escapes attribute values.\n\n## Keyboard\n\n| Key | Action |\n| --- | --- |\n| Tab | Moves focus to the input. |\n| Enter | Submits the form when the input is in a form. |\n"
}
