{
  "name": "switch",
  "version": "0.1.0",
  "description": "A control for an immediate on or off setting.",
  "kind": "component",
  "files": [
    {
      "path": "Switch.gx",
      "target": "ui/switch/Switch.gx",
      "content": "package switches\n\nprops {\n  Name    string   = \"\"\n  Label   string   = \"\"\n  Value   string   = \"on\"\n  Checked bool     = false\n  Class   string   = \"\"\n  Attrs   gx.Attrs = nil\n}\n\n\u003clabel class={gx.Cx(\"inline-flex h-5 w-9 shrink-0 cursor-pointer items-center rounded-full border border-transparent bg-input transition-colors has-[:checked]:bg-primary\", p.Class)} {...p.Attrs}\u003e\n  \u003cinput type=\"checkbox\" role=\"switch\" name={p.Name} aria-label={p.Label} value={p.Value} checked={p.Checked} class=\"peer sr-only\" /\u003e\n  \u003cspan class=\"pointer-events-none block size-4 translate-x-0.5 rounded-full bg-background shadow-lg transition-transform peer-checked:translate-x-4\"\u003e\u003c/span\u003e\n\u003c/label\u003e\n",
      "sha256": "989b955e605515f5908948d428435531b7bdb7ae8f2e5a666947cc983b5d1fc5"
    },
    {
      "path": "Switch.fixtures.go",
      "target": "ui/switch/Switch.fixtures.go",
      "content": "package switches\n\nimport \"github.com/alternayte/gx\"\n\nvar SwitchFixtures = gx.Fixtures[SwitchProps]{\n\t\"Off\":      {Name: \"wifi\", Label: \"Wifi\"},\n\t\"On\":       {Name: \"wifi\", Label: \"Wifi\", Checked: true},\n\t\"Disabled\": {Name: \"wifi\", Label: \"Wifi\", Attrs: gx.Attrs{gx.Bool(\"disabled\", true)}},\n}\n",
      "sha256": "15a93a544267db943cc2bb3f3a060dc1abcf366eb6aa3e943081da57774a51c1"
    }
  ],
  "requiredTokens": [
    "--input",
    "--primary",
    "--background"
  ],
  "usage": "# Switch\n\nA control for an immediate on or off setting.\n\n## Usage\n\n```gx\n\u003cswitch.Switch name=\"wifi\" checked={p.Wifi} /\u003e\n```\n\n## Do\n\n- Use a switch when the change takes effect at once.\n- Pair the switch with a visible label.\n\n## Don't\n\n- Do not use a switch inside a form that needs a submit button.\n- Do not use a switch for a multi-choice setting.\n\n## Keyboard\n\n| Key | Action |\n| --- | --- |\n| Tab | Moves focus to the switch. |\n| Space | Toggles the switch. |\n"
}
