{
  "name": "tabs",
  "version": "0.1.0",
  "description": "Exclusive panels behind a row of tab buttons.",
  "kind": "component",
  "files": [
    {
      "path": "Tabs.gx",
      "target": "ui/tabs/Tabs.gx",
      "content": "package tabs\n\nprops {\n  Sync     string   = \"\"\n  Default  string   = \"\"\n  Class    string   = \"\"\n  Children gx.Node\n  Attrs    gx.Attrs = nil\n}\n\n\u003cdiv class={gx.Cx(\"w-full\", p.Class)} data-gx-tabs data-sync={p.Sync} data-default={p.Default} {...p.Attrs}\u003e{p.Children}\u003c/div\u003e\n",
      "sha256": "d17abc2514bf2ca6137f58b5ed46670b577574629b8f4a5fa2ea1b3c8561ad14"
    },
    {
      "path": "TabItem.gx",
      "target": "ui/tabs/TabItem.gx",
      "content": "package tabs\n\nprops {\n  Label    string\n  Class    string   = \"\"\n  Children gx.Node\n  Attrs    gx.Attrs = nil\n}\n\n\u003cdiv class={gx.Cx(\"\", p.Class)} data-gx-tab-item {...p.Attrs}\u003e\n  \u003cbutton type=\"button\" aria-expanded=\"false\" tabindex=\"-1\" data-gx-tab={p.Label} class=\"-mb-px border-b-2 border-transparent px-3 py-1.5 text-sm font-medium text-muted-foreground hover:text-foreground data-[selected=true]:border-foreground data-[selected=true]:text-foreground\"\u003e{p.Label}\u003c/button\u003e\n  \u003cdiv class=\"pt-4\" data-gx-tab-panel\u003e{p.Children}\u003c/div\u003e\n\u003c/div\u003e\n",
      "sha256": "dfbb29c5fa7e14344c3b8bfa0833eca856950f89375d0f56409417f0954c19fc"
    },
    {
      "path": "Tabs.fixtures.go",
      "target": "ui/tabs/Tabs.fixtures.go",
      "content": "package tabs\n\nimport \"github.com/alternayte/gx\"\n\nvar TabsFixtures = gx.Fixtures[TabsProps]{\n\t\"Two\": {Children: gx.Frag(\n\t\tTabItem(TabItemProps{Label: \"Account\", Children: gx.Text(\"Account settings.\")}),\n\t\tTabItem(TabItemProps{Label: \"Password\", Children: gx.Text(\"Password settings.\")}),\n\t)},\n\t\"Synced\": {Sync: \"demo-tabs\", Children: gx.Frag(\n\t\tTabItem(TabItemProps{Label: \"First\", Children: gx.Text(\"First panel.\")}),\n\t\tTabItem(TabItemProps{Label: \"Second\", Children: gx.Text(\"Second panel.\")}),\n\t)},\n}\n",
      "sha256": "6acecc43844a9b5b6fc304de64aefc4f427220424b1e4804dba7c108163919ce"
    },
    {
      "path": "TabItem.fixtures.go",
      "target": "ui/tabs/TabItem.fixtures.go",
      "content": "package tabs\n\nimport \"github.com/alternayte/gx\"\n\nvar TabItemFixtures = gx.Fixtures[TabItemProps]{\n\t\"Item\": {Label: \"Account\", Children: gx.Text(\"Panel.\")},\n}\n\n// TabItemWrap renders the item inside a tab group, as a page uses it.\nfunc TabItemWrap(n gx.Node) gx.Node {\n\treturn Tabs(TabsProps{Children: n})\n}\n",
      "sha256": "4343c56b671c5cb28a4a019d9d93bc40cd5636a8913e5e38dafecddbd87a89f8"
    }
  ],
  "requiredTokens": [
    "--foreground",
    "--muted-foreground",
    "--border"
  ],
  "usage": "# Tabs\n\nExclusive panels behind a row of tab buttons.\n\n## Usage\n\n```gx\n\u003ctabs.Tabs default=\"Account\"\u003e\n  \u003ctabs.TabItem label=\"Account\"\u003eAccount settings.\u003c/tabs.TabItem\u003e\n  \u003ctabs.TabItem label=\"Password\"\u003ePassword settings.\u003c/tabs.TabItem\u003e\n\u003c/tabs.Tabs\u003e\n```\n\nTwo tab groups with the same `Sync` key keep one selection and remember it per viewer.\n\n## Do\n\n- Put a short label on each tab.\n- Use `Sync` when two groups must move together.\n\n## Don't\n\n- Do not hide primary navigation in tabs.\n- Do not use tabs for steps of a process. Use a page or a form.\n\n## Keyboard\n\n| Key | Action |\n| --- | --- |\n| Tab | Enters the tab list at the selected tab. |\n| Enter, Space | Selects the focused tab. |\n"
}
