{
  "name": "separator",
  "version": "0.1.0",
  "description": "A visual divider between content.",
  "kind": "component",
  "files": [
    {
      "path": "Separator.gx",
      "target": "ui/separator/Separator.gx",
      "content": "package separator\n\nprops {\n  Orientation Orientation = Horizontal\n  Decorative  bool        = true\n  Class       string      = \"\"\n  Attrs       gx.Attrs    = nil\n}\n\n\u003cdiv {...p.attrs()}\u003e\u003c/div\u003e\n",
      "sha256": "5b5532f36974763a30a4bd59387a755c5fd1daf8bfcb086644b8b9873cfc0323"
    },
    {
      "path": "Separator.fixtures.go",
      "target": "ui/separator/Separator.fixtures.go",
      "content": "package separator\n\nimport \"github.com/alternayte/gx\"\n\nvar SeparatorFixtures = gx.Fixtures[SeparatorProps]{\n\t\"Horizontal\": {Class: \"w-40\"},\n\t\"Vertical\":   {Orientation: Vertical, Class: \"h-8\"},\n}\n",
      "sha256": "2a45758af50b52b3b7ec945cabe08473b735edaca6e987541cb3c51c61f76232"
    },
    {
      "path": "styles.go",
      "target": "ui/separator/styles.go",
      "content": "package separator\n\nimport \"github.com/alternayte/gx\"\n\n// Orientation is the direction of a separator.\ntype Orientation string\n\n// The orientations of separator.Separator.\nconst (\n\tHorizontal Orientation = \"horizontal\"\n\tVertical   Orientation = \"vertical\"\n)\n\nvar orientationClass = gx.Enum[Orientation]{\n\tHorizontal: \"h-px w-full\",\n\tVertical:   \"h-full w-px\",\n}\n\n// sizeClass returns the classes of one orientation; a zero value is\n// Horizontal.\nfunc (p SeparatorProps) sizeClass() string {\n\tif p.Orientation == \"\" {\n\t\treturn orientationClass[Horizontal]\n\t}\n\treturn orientationClass[p.Orientation]\n}\n\n// attrs returns the attributes of one separator.\nfunc (p SeparatorProps) attrs() gx.Attrs {\n\ta := gx.Attrs{\n\t\t{Key: \"role\", Value: \"separator\"},\n\t\t{Key: \"data-orientation\", Value: string(p.Orientation)},\n\t\t{Key: \"class\", Value: gx.Cx(\"shrink-0 bg-border\", p.sizeClass(), p.Class)},\n\t}\n\tif p.Decorative {\n\t\ta = append(a, gx.Attr{Key: \"aria-hidden\", Value: \"true\"})\n\t}\n\treturn a\n}\n",
      "sha256": "0e4ff0b1177424059295b008a80dd7818ff47b3006afaff64143ea0a2a49918d"
    }
  ],
  "requiredTokens": [
    "--border"
  ],
  "usage": "# Separator\n\nA visual divider between content.\n\n## Usage\n\n```gx\n\u003cseparator.Separator /\u003e\n\u003cseparator.Separator orientation={separator.Vertical} class=\"h-6\" /\u003e\n```\n\n## Do\n\n- Use a separator between groups that need a visual break.\n- Keep the decorative default for a pure layout line.\n\n## Don't\n\n- Do not use a separator where whitespace is enough.\n- Do not set `Decorative` to false unless the line is a real landmark.\n\n## Keyboard\n\n| Key | Action |\n| --- | --- |\n| None | The component is static. |\n"
}
