{
  "name": "signup",
  "version": "0.1.0",
  "description": "A sign-up page block with fields, terms and a brand panel.",
  "kind": "block",
  "files": [
    {
      "path": "Signup.gx",
      "target": "ui/signup/Signup.gx",
      "content": "package signup\n\nimport (\n\t\"github.com/alternayte/gx/registry/button\"\n\t\"github.com/alternayte/gx/registry/card\"\n\t\"github.com/alternayte/gx/registry/checkbox\"\n\t\"github.com/alternayte/gx/registry/field\"\n\t\"github.com/alternayte/gx/registry/input\"\n)\n\nprops {\n  Title       string = \"Create an account\"\n  Description string = \"Start with your email.\"\n  Action      gx.URL = \"\"\n}\n\n\u003cdiv class=\"grid min-h-screen lg:grid-cols-2\"\u003e\n  \u003cdiv class=\"flex items-center justify-center p-6\"\u003e\n    \u003ccard.Card title={p.Title} description={p.Description} class=\"w-full max-w-sm\"\u003e\n      \u003cform method=\"post\" action={p.Action} class=\"flex flex-col gap-4\"\u003e\n        \u003cfield.Field\u003e\n          \u003cfield.FieldLabel for=\"name\"\u003eName\u003c/field.FieldLabel\u003e\n          \u003cinput.Input id=\"name\" name=\"name\" type=\"text\" /\u003e\n        \u003c/field.Field\u003e\n        \u003cfield.Field\u003e\n          \u003cfield.FieldLabel for=\"email\"\u003eEmail\u003c/field.FieldLabel\u003e\n          \u003cinput.Input id=\"email\" name=\"email\" type=\"email\" placeholder=\"you@example.com\" /\u003e\n        \u003c/field.Field\u003e\n        \u003cfield.Field\u003e\n          \u003cfield.FieldLabel for=\"password\"\u003ePassword\u003c/field.FieldLabel\u003e\n          \u003cinput.Input id=\"password\" name=\"password\" type=\"password\" /\u003e\n          \u003cfield.FieldDescription\u003eAt least 12 characters.\u003c/field.FieldDescription\u003e\n        \u003c/field.Field\u003e\n        \u003ccheckbox.Checkbox name=\"terms\"\u003eI accept the terms\u003c/checkbox.Checkbox\u003e\n        \u003cbutton.Button type=\"submit\" class=\"w-full\"\u003eCreate account\u003c/button.Button\u003e\n        \u003cp class=\"text-center text-sm text-muted-foreground\"\u003eAlready have an account? \u003ca href=\"/login\" class=\"underline underline-offset-4\"\u003eSign in\u003c/a\u003e\u003c/p\u003e\n      \u003c/form\u003e\n    \u003c/card.Card\u003e\n  \u003c/div\u003e\n  \u003cdiv class=\"hidden flex-col justify-between bg-muted p-10 lg:flex\"\u003e\n    \u003ca href=\"/\" class=\"font-semibold no-underline\"\u003eGx\u003c/a\u003e\n    \u003cp class=\"max-w-sm text-sm text-muted-foreground\"\u003eTyped templates, routes and forms in one loop.\u003c/p\u003e\n  \u003c/div\u003e\n\u003c/div\u003e\n",
      "sha256": "f4c95db0c468128c987376a65f179e710f74c6034bd3626a391a37a4373cb83e"
    },
    {
      "path": "Signup.fixtures.go",
      "target": "ui/signup/Signup.fixtures.go",
      "content": "package signup\n\nimport \"github.com/alternayte/gx\"\n\nvar SignupFixtures = gx.Fixtures[SignupProps]{\n\t\"Default\": {Title: \"Create an account\", Description: \"Start with your email.\"},\n}\n",
      "sha256": "24c15cf9e4f7eae2aa4f6beec795dac1c841725ddfc24932421a553d5adb02ed"
    }
  ],
  "registryDependencies": [
    "button",
    "card",
    "checkbox",
    "field",
    "input"
  ],
  "requiredTokens": [
    "--muted",
    "--muted-foreground",
    "--border",
    "--card",
    "--primary",
    "--primary-foreground",
    "--ring",
    "--input"
  ],
  "usage": "# Signup\n\nA sign-up page block with fields, terms and a brand panel.\n\n## Usage\n\n```gx\n\u003csignup.Signup action=\"/signup\" /\u003e\n```\n\nThe block is copied source. Replace the raw form with a typed `gx.Form` and route input when the app has its sign-up route.\n\n## Do\n\n- State the password rule in the hint.\n- Keep the terms checkbox next to the submit button.\n\n## Don't\n\n- Do not ask for data the app does not need.\n- Do not submit before the terms are accepted.\n\n## Keyboard\n\n| Key | Action |\n| --- | --- |\n| Tab | Moves between fields, the terms checkbox and the button. |\n| Space | Toggles the terms checkbox. |\n| Enter | Submits the form from a field. |\n"
}
