{
  "name": "progress",
  "version": "0.1.0",
  "description": "A bar that shows the completion of a task.",
  "kind": "component",
  "files": [
    {
      "path": "Progress.gx",
      "target": "ui/progress/Progress.gx",
      "content": "package progress\n\nprops {\n  Value int      = 0\n  Max   int      = 100\n  Label string   = \"\"\n  Class string   = \"\"\n  Attrs gx.Attrs = nil\n}\n\n\u003cprogress value={p.Value} max={p.max()} aria-label={p.Label} class={gx.Cx(\"h-2 w-full overflow-hidden rounded-full [\u0026::-moz-progress-bar]:bg-primary [\u0026::-webkit-progress-bar]:rounded-full [\u0026::-webkit-progress-bar]:bg-muted [\u0026::-webkit-progress-value]:rounded-full [\u0026::-webkit-progress-value]:bg-primary\", p.Class)} {...p.Attrs}\u003e\u003c/progress\u003e\n",
      "sha256": "aeb52fa3d4436fd4926b2ae388ccfb880f53f6859a3e9720882f4a90f13c37d8"
    },
    {
      "path": "Progress.fixtures.go",
      "target": "ui/progress/Progress.fixtures.go",
      "content": "package progress\n\nimport \"github.com/alternayte/gx\"\n\nvar ProgressFixtures = gx.Fixtures[ProgressProps]{\n\t\"Half\":  {Value: 50, Label: \"Upload\"},\n\t\"Full\":  {Value: 100, Label: \"Upload\"},\n\t\"Empty\": {Value: 0, Label: \"Upload\"},\n}\n",
      "sha256": "3a22ec4936118f3aef9dfb1a318da9bed0bcfd51c39c118a91dadc0fc944dad1"
    },
    {
      "path": "styles.go",
      "target": "ui/progress/styles.go",
      "content": "package progress\n\n// max returns the maximum value; a zero value is 100.\nfunc (p ProgressProps) max() int {\n\tif p.Max == 0 {\n\t\treturn 100\n\t}\n\treturn p.Max\n}\n",
      "sha256": "d30f3d0d9ba7c2f6153f5913cca74b179e713102d327957efb5294a89394c3af"
    }
  ],
  "requiredTokens": [
    "--primary",
    "--muted"
  ],
  "usage": "# Progress\n\nA bar that shows the completion of a task.\n\n## Usage\n\n```gx\n\u003cprogress.Progress value={p.Done} max={p.Total} label=\"Upload\" /\u003e\n```\n\n## Do\n\n- Set `Label` so the bar has an accessible name.\n- Update the value as the task advances.\n\n## Don't\n\n- Do not use a progress bar for an unknown duration. Use a spinner.\n- Do not animate the bar backward without a reason.\n\n## Keyboard\n\n| Key | Action |\n| --- | --- |\n| None | The component is static. |\n"
}
