{
  "name": "slider",
  "version": "0.1.0",
  "description": "A native range control.",
  "kind": "component",
  "files": [
    {
      "path": "Slider.gx",
      "target": "ui/slider/Slider.gx",
      "content": "package slider\n\nprops {\n  // Orientation sets the direction: Horizontal or Vertical.\n  Orientation Orientation = Horizontal\n  // Name is the form field name.\n  Name        string = \"\"\n  // Min is the minimum value.\n  Min         int = 0\n  // Max is the maximum value. A zero value is 100.\n  Max         int = 100\n  // Value is the value of the first render.\n  Value       int = 0\n  // Step is the size of one step. A zero value is 1.\n  Step        int = 1\n  // Label is the accessible name of the slider.\n  Label       string = \"\"\n  // Disabled disables the slider.\n  Disabled    bool = false\n  // Class adds classes to the root element.\n  Class       string = \"\"\n  // Attrs adds HTML attributes to the root element.\n  Attrs       gx.Attrs = nil\n}\n\n\u003cinput type=\"range\" name={p.Name} min={p.min()} max={p.max()} value={p.Value} step={p.step()} aria-label={p.Label} disabled={p.Disabled} data-gx-behavior style={p.fill()} class={p.class()} {...p.Attrs} /\u003e\n",
      "sha256": "bbef580da7cd2ce16e401f5ac732266fedc3332c31bad618a8bb3bf0348ae681"
    },
    {
      "path": "Slider.fixtures.go",
      "target": "ui/slider/Slider.fixtures.go",
      "content": "package slider\n\nimport \"github.com/alternayte/gx\"\n\nvar SliderFixtures = gx.Fixtures[SliderProps]{\n\t\"Half\":     {Name: \"volume\", Value: 50, Label: \"Volume\"},\n\t\"Full\":     {Name: \"volume\", Value: 100, Label: \"Volume\"},\n\t\"Empty\":    {Name: \"volume\", Value: 0, Label: \"Volume\"},\n\t\"Range\":    {Name: \"price\", Min: 10, Max: 200, Value: 80, Step: 10, Label: \"Price\"},\n\t\"Disabled\": {Name: \"volume\", Value: 50, Label: \"Volume\", Disabled: true},\n\t\"Vertical\": {Name: \"level\", Value: 50, Label: \"Level\", Orientation: Vertical, Class: \"h-44\"},\n}\n",
      "sha256": "f93740a885e9cbd05a982f0e6bc98be90a2683cede68f85e74a3fdc37571e966"
    },
    {
      "path": "styles.go",
      "target": "ui/slider/styles.go",
      "content": "package slider\n\nimport (\n\t\"strconv\"\n\n\t\"github.com/alternayte/gx\"\n)\n\n// Orientation is the direction of a slider.\ntype Orientation string\n\n// The orientations of slider.Slider.\nconst (\n\tHorizontal Orientation = \"horizontal\"\n\tVertical   Orientation = \"vertical\"\n)\n\n// The track and the thumb of a native range input are pseudo-elements with\n// one name per engine. WebKit and Blink have no pseudo-element for the range,\n// so the track paints it with a gradient up to --gx-fill; Gecko has\n// ::-moz-range-progress.\nvar orientationClass = gx.Enum[Orientation]{\n\tHorizontal: \"h-1.5 w-full [\u0026::-webkit-slider-runnable-track]:h-1.5 [\u0026::-webkit-slider-runnable-track]:bg-[linear-gradient(to_right,var(--primary)_var(--gx-fill),var(--muted)_var(--gx-fill))] [\u0026::-webkit-slider-thumb]:-mt-[5px] [\u0026::-moz-range-track]:h-1.5 [\u0026::-moz-range-progress]:h-1.5\",\n\tVertical:   \"h-full min-h-44 w-1.5 [direction:rtl] [writing-mode:vertical-lr] [\u0026::-webkit-slider-runnable-track]:w-1.5 [\u0026::-webkit-slider-runnable-track]:bg-[linear-gradient(to_top,var(--primary)_var(--gx-fill),var(--muted)_var(--gx-fill))] [\u0026::-webkit-slider-thumb]:-ml-[5px] [\u0026::-moz-range-track]:w-1.5 [\u0026::-moz-range-progress]:w-1.5\",\n}\n\n// class returns the classes of one slider.\nfunc (p SliderProps) class() string {\n\tconst base = \"block touch-none appearance-none bg-transparent outline-none select-none disabled:pointer-events-none disabled:opacity-50 [\u0026::-webkit-slider-runnable-track]:rounded-full [\u0026::-webkit-slider-thumb]:box-border [\u0026::-webkit-slider-thumb]:size-4 [\u0026::-webkit-slider-thumb]:appearance-none [\u0026::-webkit-slider-thumb]:rounded-full [\u0026::-webkit-slider-thumb]:border [\u0026::-webkit-slider-thumb]:border-primary [\u0026::-webkit-slider-thumb]:bg-white [\u0026::-webkit-slider-thumb]:shadow-sm [\u0026::-webkit-slider-thumb]:ring-ring/50 [\u0026::-webkit-slider-thumb]:transition-[color,box-shadow] [\u0026::-webkit-slider-thumb]:hover:ring-4 focus-visible:[\u0026::-webkit-slider-thumb]:ring-4 motion-reduce:[\u0026::-webkit-slider-thumb]:transition-none [\u0026::-moz-range-track]:rounded-full [\u0026::-moz-range-track]:bg-muted [\u0026::-moz-range-progress]:rounded-full [\u0026::-moz-range-progress]:bg-primary [\u0026::-moz-range-thumb]:box-border [\u0026::-moz-range-thumb]:size-4 [\u0026::-moz-range-thumb]:rounded-full [\u0026::-moz-range-thumb]:border [\u0026::-moz-range-thumb]:border-primary [\u0026::-moz-range-thumb]:bg-white [\u0026::-moz-range-thumb]:shadow-sm [\u0026::-moz-range-thumb]:ring-ring/50 [\u0026::-moz-range-thumb]:transition-[color,box-shadow] [\u0026::-moz-range-thumb]:hover:ring-4 focus-visible:[\u0026::-moz-range-thumb]:ring-4 motion-reduce:[\u0026::-moz-range-thumb]:transition-none\"\n\torientation := p.Orientation\n\tif orientation == \"\" {\n\t\torientation = Horizontal\n\t}\n\treturn gx.Cx(base, orientationClass[orientation], p.Class)\n}\n\n// min returns the minimum value.\nfunc (p SliderProps) min() int {\n\treturn p.Min\n}\n\n// max returns the maximum value; a zero value is 100.\nfunc (p SliderProps) max() int {\n\tif p.Max == 0 {\n\t\treturn 100\n\t}\n\treturn p.Max\n}\n\n// step returns the step; a zero value is 1.\nfunc (p SliderProps) step() int {\n\tif p.Step == 0 {\n\t\treturn 1\n\t}\n\treturn p.Step\n}\n\n// fill returns the custom property that paints the range of the first\n// render. The behaviour runtime updates it on input.\nfunc (p SliderProps) fill() gx.Style {\n\tspan := p.max() - p.min()\n\tv := p.Value - p.min()\n\tif span \u003c= 0 || v \u003c 0 {\n\t\tv, span = 0, 1\n\t}\n\tif v \u003e span {\n\t\tv = span\n\t}\n\treturn gx.Style(\"--gx-fill: \" + strconv.Itoa(v*100/span) + \"%\")\n}\n",
      "sha256": "486d492dfd0f9cf45d8bd247f36d3dc7a5ffe3740ef32f793fede9432f97b9b5"
    }
  ],
  "requiredTokens": [
    "--muted",
    "--primary",
    "--ring"
  ],
  "usage": "# Slider\n\nA native range control.\n\n## Usage\n\n```gx\n\u003cslider.Slider name=\"volume\" value={p.Volume} label=\"Volume\" /\u003e\n\u003cslider.Slider name=\"level\" value={p.Level} label=\"Level\" orientation={slider.Vertical} /\u003e\n```\n\nThe component is a styled native `\u003cinput type=\"range\"\u003e`.\nThe server paints the range for the first render. The behaviour runtime repaints it on input in Chrome and Safari. Firefox paints the range itself.\nA slider has one thumb.\n\n## Do\n\n- Set `Min`, `Max` and `Step` for the range.\n- Give the slider a `Label`.\n\n## Don't\n\n- Do not use a slider for an exact number. Use an input.\n- Do not omit the label.\n\n## Keyboard\n\n| Key | Action |\n| --- | --- |\n| Tab | Moves focus to the slider. |\n| Arrow keys | Changes the value by one step. |\n| Home, End | Moves to the minimum or maximum. |\n"
}
