{
  "name": "dialog",
  "version": "0.1.0",
  "description": "A modal overlay with a trigger.",
  "kind": "component",
  "files": [
    {
      "path": "Dialog.gx",
      "target": "ui/dialog/Dialog.gx",
      "content": "package dialog\n\nimport \"github.com/alternayte/gx/registry/icons\"\n\nprops {\n  // Id is the id of the dialog element.\n  // The trigger points at it, so it must be unique on the page.\n  Id          string\n  // Title is the heading of the dialog. An empty value renders no heading.\n  Title       string = \"\"\n  // Description is the text below the title. An empty value renders no description.\n  Description string = \"\"\n  // Trigger is the control that opens the dialog.\n  Trigger     gx.Node = nil\n  // Footer is the content of the dialog footer, for example the main action. A nil value renders\n  // no footer.\n  Footer      gx.Node = nil\n  // Open renders the dialog open. The default is closed.\n  Open        bool = false\n  // Class adds classes to the dialog element.\n  Class       string = \"\"\n  // Children is the content of the dialog body.\n  Children    gx.Node = nil\n  // Attrs adds HTML attributes to the dialog element.\n  Attrs       gx.Attrs = nil\n}\n\n\u003cspan class=\"contents\"\u003e\n  if p.Trigger != nil {\n    \u003cspan data-gx-open={\"#\" + p.Id} class=\"contents\"\u003e{p.Trigger}\u003c/span\u003e\n  }\n  \u003cdialog id={p.Id} open={p.Open} data-gx-dismiss data-gx-trap class={gx.Cx(\"fixed inset-0 m-auto h-fit w-full max-w-[calc(100%-2rem)] gap-4 rounded-lg border border-border bg-background p-6 text-foreground shadow-lg outline-none open:grid sm:max-w-lg opacity-0 scale-95 transition-[opacity,scale,overlay,display] transition-discrete duration-200 open:opacity-100 open:scale-100 starting:open:opacity-0 starting:open:scale-95 motion-reduce:transition-none backdrop:bg-black/50 backdrop:opacity-0 backdrop:transition-[opacity,overlay,display] backdrop:transition-discrete backdrop:duration-200 open:backdrop:opacity-100 starting:open:backdrop:opacity-0 motion-reduce:backdrop:transition-none\", p.Class)} {...p.Attrs}\u003e\n    if p.Title != \"\" || p.Description != \"\" {\n      \u003cdiv class=\"flex flex-col gap-2 text-center sm:text-left\"\u003e\n        if p.Title != \"\" {\n          \u003ch2 class=\"text-lg leading-none font-semibold\"\u003e{p.Title}\u003c/h2\u003e\n        }\n        if p.Description != \"\" {\n          \u003cp class=\"text-sm text-muted-foreground\"\u003e{p.Description}\u003c/p\u003e\n        }\n      \u003c/div\u003e\n    }\n    if p.Children != nil {\n      \u003cdiv class=\"text-sm\"\u003e{p.Children}\u003c/div\u003e\n    }\n    if p.Footer != nil {\n      \u003cdiv class=\"flex flex-col-reverse gap-2 sm:flex-row sm:justify-end\"\u003e{p.Footer}\u003c/div\u003e\n    }\n    \u003cbutton type=\"button\" data-gx-close class=\"absolute top-4 right-4 rounded-xs opacity-70 ring-offset-background transition-opacity hover:opacity-100 focus:ring-2 focus:ring-ring focus:ring-offset-2 focus:outline-hidden disabled:pointer-events-none\"\u003e\n      \u003cicons.X class=\"size-4\" /\u003e\n      \u003cspan class=\"sr-only\"\u003eClose\u003c/span\u003e\n    \u003c/button\u003e\n  \u003c/dialog\u003e\n\u003c/span\u003e\n",
      "sha256": "0c39aa04b3daf9e891070072af9cec7401f8d58ff2c6aa461e501a6b26bb6f42"
    },
    {
      "path": "Dialog.fixtures.go",
      "target": "ui/dialog/Dialog.fixtures.go",
      "content": "package dialog\n\nimport (\n\t\"github.com/alternayte/gx\"\n\t\"github.com/alternayte/gx/registry/button\"\n)\n\nvar DialogFixtures = gx.Fixtures[DialogProps]{\n\t\"Default\": {\n\t\tId:          \"demo-dialog\",\n\t\tTitle:       \"Edit profile\",\n\t\tDescription: \"Change your display name.\",\n\t\tChildren:    gx.Text(\"Dialog body.\"),\n\t\tFooter:      button.Button(button.ButtonProps{Children: gx.Text(\"Save\")}),\n\t\tTrigger:     button.Button(button.ButtonProps{Variant: button.Outline, Children: gx.Text(\"Open dialog\")}),\n\t},\n}\n",
      "sha256": "a84e23e01d61e0d0afd4e318fe1244c9545ee5563a43724f6c155f3341094784"
    }
  ],
  "registryDependencies": [
    "button",
    "icons"
  ],
  "requiredTokens": [
    "--background",
    "--foreground",
    "--border",
    "--muted",
    "--muted-foreground",
    "--ring"
  ],
  "usage": "# Dialog\n\nA modal overlay with a trigger.\n\n## Usage\n\n```gx\n\u003cdialog.Dialog id=\"edit\" title=\"Edit profile\" footer={saveButton}\u003e\n  \u003c:trigger\u003e\u003cbutton.Button variant={button.Outline}\u003eOpen\u003c/button.Button\u003e\u003c/:trigger\u003e\n  \u003cp\u003eDialog body.\u003c/p\u003e\n\u003c/dialog.Dialog\u003e\n```\n\n## Do\n\n- Give every dialog a unique `Id`.\n- Put the main action in `Footer` and a close control in the corner.\n\n## Don't\n\n- Do not open a dialog from another dialog.\n- Do not put a long form in a dialog. Use a page.\n\n## Keyboard\n\n| Key | Action |\n| --- | --- |\n| Enter, Space | Opens the dialog from the trigger. |\n| Tab | Cycles through the controls of the dialog. |\n| Escape | Closes the dialog. |\n"
}
